State,County,City,Title,Link,Price,Date Time,Location,Organiser,Website Link,Facebook Link,Twitter Link,Instagram Link
New York,New York,New York,2023 IFPDA Print Fair,https://www.eventbrite.com/e/2023-ifpda-print-fair-tickets-632870140627?aff=ebdssbdestsearch,,"Thu, Oct 26 •  12:00 PM ","Jacob K. Javits Convention Center 655 West 34th Street River Pavilion New York, NY 10001",IFPDA | International Fine Print Dealers Assoc,https://www.ifpda.org/,https://www.facebook.com/ifpda,,
New York,New York,New York,New York African Restaurant Week  Festival 2023,https://www.eventbrite.com/e/new-york-african-restaurant-week-festival-2023-tickets-258083844727?aff=ebdssbdestsearch,,Saturday • 11:00 AM,"City College - Harlem 160 Convent Avenue New York, NY 10031",African Restaurant Week,http://africanrestaurantweek.com,https://www.facebook.com/nyafricanrestaurantweek,,
New York,New York,New York,Chelsea Film Festival 2023 Passes,https://www.eventbrite.com/e/chelsea-film-festival-2023-passes-tickets-662463184217?aff=ebdssbdestsearch,,Tomorrow • 6:00 PM,"Regal Union Square 4DX & ScreenX 850 Broadway New York, NY 10003",Chelsea Film Festival,,https://www.facebook.com/chelseafilmfestival,https://www.twitter.com/chelseafilm,
New York,Kings,Brooklyn,A Current Affair: Pop Up Vintage Marketplace in Brooklyn | Fall 2023,https://www.eventbrite.com/e/a-current-affair-pop-up-vintage-marketplace-in-brooklyn-fall-2023-tickets-606863694647?aff=ebdssbdestsearch,,Saturday • 12:00 PM,"Industry City 51 34th street Brooklyn, NY 11232",A Current Affair,http://itsacurrentaffair.com,https://www.facebook.com/itsacurrentaffair,,
New York,New York,New York,NYC Fungus Festival 2023,https://www.eventbrite.com/e/nyc-fungus-festival-2023-tickets-707452468377?aff=ebdssbdestsearch,,Sunday • 11:00 AM,"Randall's Island Urban Farm Wards Meadow Loop New York, NY 10035",New York Mycological Society,https://newyorkmyc.org,,,
New Jersey,Hudson,Jersey City,Art Fair 14C - 5th Edition,https://www.eventbrite.com/e/art-fair-14c-5th-edition-tickets-696237163097?aff=ebdssbdestsearch,,Tomorrow • 3:00 PM,"Central Railroad of New Jersey Terminal 1 Audrey Zapp Drive Jersey City, NJ 07305",Art Fair 14C,http://www.artfair14c.com,https://www.facebook.com/artfair14c,https://www.twitter.com/artfair14c,
New York,Kings,Brooklyn,The Brooklyn Pancakes & Booze Art Show,https://www.eventbrite.com/e/the-brooklyn-pancakes-booze-art-show-tickets-688109543167?aff=ebdssbdestsearch,,Saturday • 7:00 PM,"9 Bob Note 270 Meserole Street Brooklyn, NY 11206",The Pancakes & Booze Art Show,,https://www.facebook.com/pancakesandboozeartshow,https://www.twitter.com/pancakesbooze,
New York,Queens,Sunnyside,Taste of Sunnyside 2023,https://www.eventbrite.com/e/taste-of-sunnyside-2023-tickets-721446785757?aff=ebdssbdestsearch,,Sunday • 2:00 PM,"Restaurants throughout Sunnyside! Lowery Plaza, 40th Street & Queens Boulevard Bliss Plaza, 46th Street & Queens Boulevard Sunnyside, NY 11104",Sunnyside Shines Business Improvement District,,https://www.facebook.com/sunnysideshines,https://www.twitter.com/sunnysideshines,
New York,Kings,Brooklyn,Playing Sam,https://www.eventbrite.com/e/playing-sam-tickets-720945155367?aff=ebdssbdestsearch,,"Fri, Oct 27 •  6:00 PM ","Williamsburg Cinemas 217 Grand Street Brooklyn, NY 11211",Bushwick Film Festival,https://watch.bushwickfilmfestival.com/,https://www.facebook.com/BushwickFilmFestival,,
New York,New York,New York,"Reel Sisters Awards Ceremony @Riverside Theater - Oct. 11, 2023",https://www.eventbrite.com/e/reel-sisters-awards-ceremony-riverside-theater-oct-11-2023-tickets-694161885887?aff=ebdssbdestsearch,,Today • 6:30 PM,"The Riverside Theatre 91 Claremont Avenue New York, NY 10027",African Voices Magazine,,https://www.facebook.com/reelsistersfilmfestival,https://www.twitter.com/africanvoices,
New York,New York,New York,Monster Puppet Workshop with Monkey Boys Productions,https://www.eventbrite.com/e/monster-puppet-workshop-with-monkey-boys-productions-tickets-725282949827?aff=ebdssbdestsearch,,"Sat, Oct 28 •  1:00 PM ","Pier 57 25 11th Avenue New York, NY 10011",Children's Museum of the Arts,http://www.cmany.org,https://www.facebook.com/childrensmuseumofthearts,https://www.twitter.com/cmainnyc,
New York,New York,New York,Children's Museum of the Arts' Halloween Pier Party!,https://www.eventbrite.com/e/childrens-museum-of-the-arts-halloween-pier-party-tickets-724217141967?aff=ebdssbdestsearch,,"Sun, Oct 29 •  11:00 AM ","Pier 57 25 11th Avenue New York, NY 10011",Children's Museum of the Arts,http://www.cmany.org,https://www.facebook.com/childrensmuseumofthearts,https://www.twitter.com/cmainnyc,
New York,Kings,Brooklyn,Experimental Feature: Little Boxes,https://www.eventbrite.com/e/experimental-feature-little-boxes-tickets-720929628927?aff=ebdssbdestsearch,,"Thu, Oct 26 •  6:15 PM ","Williamsburg Cinemas 217 Grand Street Brooklyn, NY 11211",Bushwick Film Festival,https://watch.bushwickfilmfestival.com/,https://www.facebook.com/BushwickFilmFestival,,
New Jersey,Essex,Newark,Community Day: Fall Festival,https://www.eventbrite.com/e/community-day-fall-festival-tickets-690863620687?aff=ebdssbdestsearch,,"Sat, Oct 21 •  12:00 PM ","The Newark Museum of Art 49 Washington St Newark, NJ 07102",The Newark Museum of Art,http://www.newarkmuseumart.org,https://www.facebook.com/NewarkMuseumArt,https://www.twitter.com/NewarkMuseumArt,
New York,Kings,Brooklyn,Bad Like Brooklyn Dance Hall,https://www.eventbrite.com/e/bad-like-brooklyn-dance-hall-tickets-720948615717?aff=ebdssbdestsearch,,"Fri, Oct 27 •  8:30 PM ","Williamsburg Cinemas 217 Grand Street Brooklyn, NY 11211",Bushwick Film Festival,https://watch.bushwickfilmfestival.com/,https://www.facebook.com/BushwickFilmFestival,,
New York,New York,New York,Sahashra Deepotsavam,https://www.eventbrite.com/e/sahashra-deepotsavam-tickets-719548046577?aff=ebdssbdestsearch,,"Fri, Oct 20 •  6:30 PM ","Bhakti Center 25 1st Avenue New York, NY 10003",The Temple at Bhakti Center,http://bhakticenter.org,,,
New York,New York,New York,Cardtopia 2023 NYC,https://www.eventbrite.com/e/cardtopia-2023-nyc-tickets-643198623397?aff=ebdssbdestsearch,,,"Moonlight Studios NYC 330 Hudson Street New York, NY 10013",Cardtopia World,https://www.cardtopiaworld.com/,https://www.facebook.com/Cardtopiaworld,https://www.twitter.com/cardtopiaworld,
New Jersey,Essex,Montclair,Perú Fusion | Grand Tasting 2023,https://www.eventbrite.com/e/peru-fusion-grand-tasting-2023-tickets-709513663467?aff=ebdssbdestsearch,,"Sun, Oct 22 •  1:00 PM ","18 Label Studios 18 Label Street Montclair, NJ 07042",Perú Fusion,,https://www.facebook.com/PeruFusionOfficial,,
New York,Kings,Brooklyn,DAYBREAKER NYC // 10-YEAR TOGETHER TOUR OCT 28TH,https://www.eventbrite.com/e/daybreaker-nyc-10-year-together-tour-oct-28th-tickets-705535996157?aff=ebdssbdestsearch,,"Sat, Oct 28 •  5:00 PM ","Green-Wood Cemetery 500 25th St Brooklyn New York, NY 11232",DAYBREAKER,,,,
New York,Queens,Long Island City,Freestyle Mondays NYC 22nd Anniversary,https://www.eventbrite.com/e/freestyle-mondays-nyc-22nd-anniversary-tickets-726203764007?aff=ebdssbdestsearch,,"Sun, Oct 22 •  2:00 PM ","Culture Lab LIC, 46th Avenue, Queens, NY, USA 5-25 46th Avenue Queens, NY 11101",Corey James Gray,,https://www.facebook.com/Freestylemondays,https://www.twitter.com/fstylemondaysny,
New York,Richmond,Staten Island,Project Caribbean Festival 2023,https://www.eventbrite.com/e/project-caribbean-festival-2023-registration-661654645857?aff=ebdssbdestsearch,,"Sat, Oct 28 •  12:00 PM ","Snug Harbor Cultural Center & Botanical Garden -- SOUTH MEADOW 1000 Richmond Terrace Staten Island, NY 10301",Project Caribbean Inc.,https://projectcaribbeaninc.org,,,
New Jersey,Hudson,Jersey City,JCAST 2023 - LGBTQ+ Art Bus Tour,https://www.eventbrite.com/e/jcast-2023-lgbtq-art-bus-tour-tickets-733999240487?aff=ebdssbdestsearch,,Saturday • 1:00 PM,"Jersey City City Hall 280 Grove Street Jersey City, NJ 07302",Art Fair 14C,http://www.artfair14c.com,https://www.facebook.com/artfair14c,https://www.twitter.com/artfair14c,
New York,New York,New York,New York's 50th Annual Village Halloween Parade,https://www.eventbrite.com/e/new-yorks-50th-annual-village-halloween-parade-tickets-495950279637?aff=ebdssbdestsearch,,"Tue, Oct 31 •  7:00 PM ","6th Avenue between Canal Street and 16th Street 6th Avenue between Canal and 16th St. New York City, NY 10014",New York City Halloween Parade,,https://www.facebook.com/events/612737329475686,https://www.twitter.com/NYCHalloween,
New Jersey,Passaic,Wayne,Alliance Resource Fair & Family Fun Day- Fall 2023,https://www.eventbrite.com/e/alliance-resource-fair-family-fun-day-fall-2023-tickets-675430991277?aff=ebdssbdestsearch,,Sunday • 11:00 AM,"William Paterson University Student Center 300 Pompton Rd. Wayne, NJ 07470",Alliance of Private Special Education Schools NJ,https://specialeducationalliancenj.org/,https://www.facebook.com/specialeducationalliancenj,,
New York,Kings,Brooklyn,"Brooklyn High School Fair: CUNY, Urban Assembly, New Visions (New Location)",https://www.eventbrite.com/e/brooklyn-high-school-fair-cuny-urban-assembly-new-visions-new-location-tickets-717343031317?aff=ebdssbdestsearch,,Today • 5:00 PM,"K527 Urban Assembly Institute of Math and Science for Young Women 283 Adams Street Brooklyn, NY 11201",CUNY & Urban Assembly Schools,https://www.cunyuaschools.org/,,https://www.twitter.com/CUNYUA_District,
New York,Bronx,Bronx,Bronx Community Justice Center Carnival,https://www.eventbrite.com/e/bronx-community-justice-center-carnival-tickets-715014205737?aff=ebdssbdestsearch,,"Sat, Oct 21 •  12:00 PM ","East 152nd Street & Tinton Avenue 152-159 between Jackson and Tinton Ave The Bronx, NY 10455",,,,,
New Jersey,Hudson,Jersey City,Hudson County Family Fun Halloween Fest,https://www.eventbrite.com/e/hudson-county-family-fun-halloween-fest-tickets-727851943757?aff=ebdssbdestsearch,,"Sat, Oct 28 •  12:00 PM ","902 Brewing Co . 101 Pacific Avenue Jersey City, NJ 07304",Hudson County Office of Cultural & Heritage Affair,https://www.visithudson.org/,,,
New York,New York,New York,Go Africa Carnival 2024 (7/20/2024),https://www.eventbrite.com/e/go-africa-carnival-2024-7202024-tickets-393798571127?aff=ebdssbdestsearch,,"Sat, Jul 20 •  10:00 AM ","216 W 116th St 216 West 116th Street Adam Clayton Powell Boulevard (7th Avenue)  and Frederick Douglass Boulevard (8th Avenue) New York, NY 10026",Go Africa Network Inc,http://goafricanetwork.org,https://www.facebook.com/goafricacarnival,https://www.twitter.com/goafricacarnival,
New York,Queens,Long Island City,NYC DOHMH - CUNY and SUNY Schools Diversity Career Consortium - 11-10-2023,https://www.eventbrite.com/e/nyc-dohmh-cuny-and-suny-schools-diversity-career-consortium-11-10-2023-tickets-698511896887?aff=ebdssbdestsearch,,"Fri, Nov 10 •  10:00 AM ","42-09 28th St 42-09 28th Street Queens, NY 11101",New York City Department of Health and Mental Hygiene,http://www1.nyc.gov/site/doh/index.page,,,
New Jersey,Hudson,Jersey City,Art Fair 14C  - Tour for the Visually Impaired,https://www.eventbrite.com/e/art-fair-14c-tour-for-the-visually-impaired-tickets-727062632907?aff=ebdssbdestsearch,,Saturday • 11:30 AM,"CRRNJ Terminal Building 1 Audrey Zapp Drive Jersey City, NJ 07305",Art Fair 14C,http://www.artfair14c.com,https://www.facebook.com/artfair14c,https://www.twitter.com/artfair14c,
New York,New York,New York,New York SBKZ Congress,https://www.eventbrite.com/e/new-york-sbkz-congress-tickets-627710808927?aff=ebdssbdestsearch,,"Fri, Feb 9 •  10:00 AM ","The Westin New York at Times Square 270 West 43rd Street New York, NY 10036",New York SBKZ Congress,https://www.nysbkzcongress.com,,,
New Jersey,Essex,West Orange,Turtle Back on Tap 2023,https://www.eventbrite.com/e/turtle-back-on-tap-2023-tickets-701939629327?aff=ebdssbdestsearch,,,"Essex County Turtle Back Zoo 560 Northfield Avenue West Orange, NJ 07052",Essex County Park System,,,,
New York,New York,New York,Latino Arts Fest 2023: Visions of Empowerment,https://www.eventbrite.com/e/latino-arts-fest-2023-visions-of-empowerment-tickets-719023367247?aff=ebdssbdestsearch,,Tomorrow • 5:00 PM,"El Barrio's Artspace PS109 215 East 99th Street New York, NY 10029",Turner Construction's Cada Comunidad ERG,,,,
New York,New York,New York,Leap Fest NYC 2.0 - East Coast's most EXCLUSIVE INDIAN SINGLES event.,https://www.eventbrite.com/e/leap-fest-nyc-20-east-coasts-most-exclusive-indian-singles-event-tickets-728652799137?aff=ebdssbdestsearch,,"Sun, Oct 29 •  12:00 PM ","Elsie Rooftop 1412 Broadway New York, NY 10018",Leap Social - the app.,https://www.leapsocial.com,,,
New York,New York,New York,Diamond Jam. SoHo Art Exhibition,https://www.eventbrite.com/e/diamond-jam-soho-art-exhibition-tickets-712553535807?aff=ebdssbdestsearch,,"Fri, Nov 3 •  6:00 PM ","425 W Broadway 425 West Broadway New York, NY 10012",The 1st Ukrainian Gallery NY,https://www.thefirstukrainiangallery.com/,,,
New York,Kings,Brooklyn,"The Other Art Fair Brooklyn: November 9 - 12, 2023",https://www.eventbrite.com/e/the-other-art-fair-brooklyn-november-9-12-2023-tickets-696787619527?aff=ebdssbdestsearch,,"Thu, Nov 9 •  6:00 PM ","ZeroSpace 337-345 Butler Street Brooklyn, NY 11217",The Other Art Fair presented by Saatchi Art,,https://www.facebook.com/theotherartfair,https://www.twitter.com/theotherartfair,
New York,Kings,Brooklyn,Bowl of 'Zole Brooklyn 2023  at Industry City,https://www.eventbrite.com/e/bowl-of-zole-brooklyn-2023-at-industry-city-tickets-675418122787?aff=ebdssbdestsearch,,"Thu, Oct 19 •  5:00 PM ","33 35th St 33 35th Street Brooklyn, NY 11232",Food Karma Projects,,https://www.facebook.com/foodkarmanyc,https://www.twitter.com/food_karma,
New Jersey,Essex,Newark,"dfree FINFE$T 2023 powered by Prudential Financial -  NEWARK, NJ",https://www.eventbrite.com/e/dfree-finfet-2023-powered-by-prudential-financial-newark-nj-tickets-717103494857?aff=ebdssbdestsearch,,Friday • 6:00 PM,"Newark Philip's Academy Charter School 342 Central Ave, Newark, NJ 07103 Newark, NJ 07103",,,,,
New Jersey,Hudson,Secaucus,2023 New Jersey Vegan Food Festival presented by the Vegan Local,https://www.eventbrite.com/e/2023-new-jersey-vegan-food-festival-presented-by-the-vegan-local-tickets-471759424137?aff=ebdssbdestsearch,,"Sat, Nov 11 •  11:00 AM ","Meadowlands Exposition Center 355 Plaza Drive Secaucus, NJ 07094",New Jersey VegFest,,https://www.facebook.com/NewJerseyVegFest,https://www.twitter.com/NJVegFest,
New York,New York,New York,"New York City Bus Trip December 9, 2023  Departing from Norfolk, VA",https://www.eventbrite.com/e/new-york-city-bus-trip-december-9-2023-departing-from-norfolk-va-tickets-665047724647?aff=ebdssbdestsearch,,"Sat, Dec 9 •  12:01 AM ","Macy's Herald Square Café 151 West 34th Street New York, NY 10001","Freedom Tours Coach Line, Inc.",,,,
New York,New York,New York,2023 Fungus Festival: Paseo de hongos en Español con Latino Outdoors,https://www.eventbrite.com/e/2023-fungus-festival-paseo-de-hongos-en-espanol-con-latino-outdoors-tickets-725179109237?aff=ebdssbdestsearch,,Sunday • 11:30 AM,"11 Wards Meadow Loop 11 Wards Meadow Loop New York, NY 10035",New York Mycological Society,https://newyorkmyc.org,,,
New York,New York,New York,Spain's Great Match 2023 NYC Evening Tasting,https://www.eventbrite.com/e/spains-great-match-2023-nyc-evening-tasting-tickets-669565136347?aff=ebdssbdestsearch,,,"Mercado Little Spain 10 Hudson Yards New York, NY 10001",Foods and Wines from Spain,https://www.foodswinesfromspain.com/en/upcoming-events/trade-shows-detail-two/spain-s-great-match-los-angeles.html,https://www.facebook.com/204636039572019,https://www.twitter.com/SpainFoodWineUS,
New York,New York,New York,FINE FAIR,https://www.eventbrite.com/e/fine-fair-tickets-717611414057?aff=ebdssbdestsearch,,"Thu, Nov 16 •  5:30 PM ","AKDO NYC Showroom 22 West 21st Street New York, NY 10010",Fine Fair Committee,,,,
New York,New York,New York,The Pierre Hotel presents Diwali : Festival of Lights 2023,https://www.eventbrite.com/e/the-pierre-hotel-presents-diwali-festival-of-lights-2023-tickets-726868983697?aff=ebdssbdestsearch,,"Fri, Nov 10 •  5:30 PM ","The Pierre, A Taj Hotel, New York 2 East 61st Street New York, NY 10065","The Pierre, A TAJ Hotel",,,,
New York,New York,New York,College Fair @ HSA,https://www.eventbrite.com/e/college-fair-hsa-tickets-703314431397?aff=ebdssbdestsearch,,Saturday • 1:00 PM,"Harlem School of the Arts 645 Saint Nicholas Avenue New York, NY 10030",Harlem School of the Arts,http://www.hsanyc.org,https://www.facebook.com/hsanyc,https://www.twitter.com/HSAnyc,
New York,Kings,Brooklyn,"Rep. Yvette D. Clarke  Presents     ""Protecting Our  Seniors: Service Expo""",https://www.eventbrite.com/e/rep-yvette-d-clarke-presents-protecting-our-seniors-service-expo-tickets-708074258167?aff=ebdssbdestsearch,,,"1561 Bedford Ave 1561 Bedford Avenue Brooklyn, NY 11225",Congresswoman Yvette D. Clarke,,,,
New York,Kings,Brooklyn,Hard (World Premiere),https://www.eventbrite.com/e/hard-world-premiere-tickets-691773512197?aff=ebdssbdestsearch,,"Sat, Oct 21 •  3:00 PM ","City Tech 300 Jay Street Brooklyn, NY 11201",African Voices Magazine,,https://www.facebook.com/reelsistersfilmfestival,https://www.twitter.com/africanvoices,
New York,Kings,Brooklyn,Day of the Dead Family Celebration,https://www.eventbrite.com/e/day-of-the-dead-family-celebration-tickets-696702204047?aff=ebdssbdestsearch,,"Wed, Nov 1 •  4:00 PM ","The Green-Wood Cemetery 500 25th Street Brooklyn, NY 11232",The Green-Wood Historic Fund,https://www.green-wood.com,https://www.facebook.com/historicgreenwood,https://www.twitter.com/greenwoodhf,
New York,New York,New York,NYC Artisanal Sweet Treats Bazaar,https://www.eventbrite.com/e/nyc-artisanal-sweet-treats-bazaar-tickets-677641763757?aff=ebdssbdestsearch,,"Sun, Oct 22 •  10:00 AM ","Grand Bazaar NYC 100 West 77th Street New York, NY 10024",Grand Bazaar NYC,https://grandbazaarnyc.org/,https://www.facebook.com/GrandBazaarNYC,https://www.twitter.com/GrandBazaarNYC,
New Jersey,Essex,Irvington,3rd Annual Experience The Legacy HBCU College Fair,https://www.eventbrite.com/e/3rd-annual-experience-the-legacy-hbcu-college-fair-registration-705058919207?aff=ebdssbdestsearch,,"Sat, Dec 2 •  10:00 AM ","Irvington High School 1253 Clinton Avenue Irvington, NJ 07111",Experience The Legacy HBCU Fair,https://www.experiencethelegacy.org,https://www.facebook.com/experiencethelegacyinc,,
New York,New York,New York,Wine and Oyster Dinner,https://www.eventbrite.com/e/wine-and-oyster-dinner-tickets-733209337867?aff=ebdssbdestsearch,,"Thu, Nov 9 •  6:00 PM ","Docks Oyster Bar 633 3rd Avenue New York, NY 10017",Docks Oyster Bar,,https://www.facebook.com/Docks-Oyster-Bar-108427555862746,https://www.twitter.com/docksoysterbar,
New York,New York,New York,Celebración Latina,https://www.eventbrite.com/e/celebracion-latina-registration-699232091007?aff=ebdssbdestsearch,,Sunday • 1:00 PM,"Ballet Hispanico 167 West 89th Street New York, NY 10024",Ballet Hispánico,https://www.ballethispanico.org/,https://www.facebook.com/ballethispanico,https://www.twitter.com/ballethispanico,
New Jersey,Essex,Newark,Art After Dark: Silent Disco,https://www.eventbrite.com/e/art-after-dark-silent-disco-tickets-689330936387?aff=ebdssbdestsearch,,"Thu, Oct 26 •  7:00 PM ","The Newark Museum of Art 49 Washington St Newark, NJ 07102",The Newark Museum of Art,http://www.newarkmuseumart.org,https://www.facebook.com/NewarkMuseumArt,https://www.twitter.com/NewarkMuseumArt,
New York,Bronx,Bronx,CMCS Job Fair,https://www.eventbrite.com/e/cmcs-job-fair-tickets-719272672927?aff=ebdssbdestsearch,,"Fri, Oct 20 •  11:00 AM ","529 Courtlandt Avenue, The Bronx, NY, USA 529 Courtlandt Avenue The Bronx, NY 10451",,,,,
New York,Kings,Brooklyn,Young Gun,https://www.eventbrite.com/e/young-gun-tickets-721010129707?aff=ebdssbdestsearch,,"Sat, Oct 28 •  6:00 PM ","Williamsburg Cinemas 217 Grand Street Brooklyn, NY 11211",Bushwick Film Festival,https://watch.bushwickfilmfestival.com/,https://www.facebook.com/BushwickFilmFestival,,
New Jersey,Passaic,Paterson,Jam N' Skate Arts Fest,https://www.eventbrite.com/e/jam-n-skate-arts-fest-tickets-669942334557?aff=ebdssbdestsearch,,"Sat, Oct 21 •  11:00 AM ","Paterson Skatepark 99-105 21st Avenue Paterson, NJ 07501","Grand Artistry Inspires, Inc",https://www.grandartistryinspires.com/,,,
New Jersey,Union,Union,Annual Pumpkin Patch Day!,https://www.eventbrite.com/e/annual-pumpkin-patch-day-tickets-718770520977?aff=ebdssbdestsearch,,"Sat, Oct 21 •  10:00 AM ","Liberty Hall Museum 1003 Morris Avenue Union, NJ 07083",Liberty Hall Museum,https://libertyhall.kean.edu/,https://www.facebook.com/1977608719220611,,
New York,Kings,Brooklyn,Fall Arts & Craft Fair at Nook,https://www.eventbrite.com/e/fall-arts-craft-fair-at-nook-tickets-722766623427?aff=ebdssbdestsearch,,"Sat, Nov 11 •  10:00 AM ","Nook 45 Irving Avenue #Unit 1 Brooklyn, NY 11237",Nook,,,,
New York,Kings,Brooklyn,VIP Pass,https://www.eventbrite.com/e/vip-pass-tickets-724286017977?aff=ebdssbdestsearch,,"Wed, Oct 25 •  6:00 PM ","Williamsburg Cinemas 217 Grand Street Brooklyn, NY 11211",Bushwick Film Festival,https://watch.bushwickfilmfestival.com/,https://www.facebook.com/BushwickFilmFestival,,
New York,Kings,Brooklyn,Aberdeen Community Garden Autumn Equinox Festival & Fundraiser,https://www.eventbrite.com/e/aberdeen-community-garden-autumn-equinox-festival-fundraiser-tickets-716585254787?aff=ebdssbdestsearch,,,"Aberdeen Street Community Garden 98 Aberdeen Street Brooklyn, NY 11207",Aberdeen Community Garden,,,,https://www.instagram.com/aberdeengarden/
New York,New York,New York,16th ANNUAL NATRAJ FOLK ARTS FESTIVAL,https://www.eventbrite.com/e/16th-annual-natraj-folk-arts-festival-tickets-674796413237?aff=ebdssbdestsearch,,"Sat, Nov 11 •  6:00 PM ","BALANCE ARTS CENTER 151 West 30th Street 3rd Floor New York, NY 10001",THE INDIA CENTER,,,https://www.twitter.com/@https://,
New York,Kings,Brooklyn,All The Songs We Never Sang,https://www.eventbrite.com/e/all-the-songs-we-never-sang-tickets-720952336847?aff=ebdssbdestsearch,,"Sat, Oct 28 •  12:30 PM ","Williamsburg Cinemas 217 Grand Street Brooklyn, NY 11211",Bushwick Film Festival,https://watch.bushwickfilmfestival.com/,https://www.facebook.com/BushwickFilmFestival,,
New York,Kings,Brooklyn,TIME OUT BEER & WINE FALL FESTIVAL,https://www.eventbrite.com/e/time-out-beer-wine-fall-festival-tickets-714668692297?aff=ebdssbdestsearch,,Saturday • 2:00 PM,"Emily Warren Roebling Plaza (Under The Brooklyn Bridge) 11 Water Street DUMBO Brooklyn, NY 11201",Time Out Market New York,https://www.timeoutmarket.com/newyork/,https://www.facebook.com/timeoutmarketnewyork,,
New Jersey,Hudson,Jersey City,Art Fair 14C  Sensory Friendly Tours,https://www.eventbrite.com/e/art-fair-14c-sensory-friendly-tours-tickets-718228640197?aff=ebdssbdestsearch,,Saturday • 11:00 AM,"CRRNJ Terminal Building 1 Audrey Zapp Drive Jersey City, NJ 07305",Art Fair 14C,http://www.artfair14c.com,https://www.facebook.com/artfair14c,https://www.twitter.com/artfair14c,
New York,New York,New York,Fall Festival,https://www.eventbrite.com/e/fall-festival-tickets-694835861767?aff=ebdssbdestsearch,,"Sat, Oct 21 •  11:00 AM ","Dyckman Farmhouse Museum 4881 Broadway Street New York, NY 10034",Dyckman Farmhouse Museum,,,,
New York,Queens,Corona,National Chemistry Week 2023 - New York Hall of Science,https://www.eventbrite.com/e/national-chemistry-week-2023-new-york-hall-of-science-tickets-694076851547?aff=ebdssbdestsearch,,Sunday • 10:00 AM,"New York Hall of Science 47-01 111th Street Queens, NY 11368",New York ACS Younger Chemist Committee,,,,
New York,New York,New York,Intl Film Festival Manhattan Awards Ceremony 2023,https://www.eventbrite.com/e/intl-film-festival-manhattan-awards-ceremony-2023-tickets-731130098807?aff=ebdssbdestsearch,,Friday • 6:00 PM,"Philippine Center New York 556 5th Avenue New York, NY 10036",Luis Pedron,,https://www.facebook.com/LuisPedron,https://www.twitter.com/IFFMNewYork,
New York,New York,New York,Dia de los Muertos: Afterlife Fiesta,https://www.eventbrite.com/e/dia-de-los-muertos-afterlife-fiesta-tickets-722934756317?aff=ebdssbdestsearch,,"Tue, Oct 24 •  7:30 PM ","El Museo del Barrio 1230 5th Avenue New York, NY 10029",El Museo del Barrio,,https://www.facebook.com/elmuseo,https://www.twitter.com/elmuseo,
New Jersey,Hudson,Hoboken,Howl-O-Ween,https://www.eventbrite.com/e/howl-o-ween-tickets-709437034267?aff=ebdssbdestsearch,,"Sat, Oct 28 •  2:00 PM ","Church Square Park 400 Garden Street Hoboken, NJ 07030",Hoboken Community Center,http://www.hobokencc.org,,https://www.twitter.com/hobcommunityctr,
New York,New York,New York,INDIAN CLASSICAL DANCE & MUSIC,https://www.eventbrite.com/e/indian-classical-dance-music-tickets-695759674917?aff=ebdssbdestsearch,,"Sat, Nov 11 •  5:00 PM ","BALANCE ARTS CENTER 151 West 30th Street 3rd Floor New York, NY 10001",THE INDIA CENTER,,,https://www.twitter.com/@https://,
New Jersey,Hudson,Jersey City,Jersey City Craft Beer Fest,https://www.eventbrite.com/e/jersey-city-craft-beer-fest-tickets-717327775687?aff=ebdssbdestsearch,,"Sat, Oct 21 •  1:00 PM  + 1 more","Harborside Atrium 210 Hudson St Jersey City, NJ 07311",Fest Productions,,https://www.facebook.com/newyorkwinefest,,
New York,Kings,Brooklyn,Fall Fest Atlantic Terminal Mall Plaza,https://www.eventbrite.com/e/fall-fest-atlantic-terminal-mall-plaza-tickets-722216367597?aff=ebdssbdestsearch,,Saturday • 11:00 AM,"Atlantic Terminal Mall 139 Flatbush Avenue Brooklyn, NY 11217",Brooklyn Bridge Parents,https://brooklynbridgeparents.com/,https://www.facebook.com/BrooklynBridgeParents,https://www.twitter.com/bbparents,
