State,County,City,Title,Link,Price,Date Time,Location,Organiser,Website Link,Facebook Link,Twitter Link,Instagram Link
Connecticut,Fairfield,Bridgeport,#FoodServes Virtual Job Fair / Career Expo Event #Bridgeport,https://www.eventbrite.com/e/foodserves-virtual-job-fair-career-expo-event-bridgeport-tickets-256580849227?aff=ebdssbdestsearch,,"Fri, Nov 3 •  11:00 AM  + 1 more","Bridgeport Virtual Event only Bridgeport, CT 06604",JobsOffice.org,https://JobsOffice.org,,https://www.twitter.com/taohq,
Connecticut,Fairfield,Bridgeport,#SanitationHires Virtual Job Fair / Career Expo Event #Bridgeport,https://www.eventbrite.com/e/sanitationhires-virtual-job-fair-career-expo-event-bridgeport-tickets-256077784547?aff=ebdssbdestsearch,,"Fri, Nov 3 •  11:00 AM  + 1 more","Bridgeport Virtual Event only Bridgeport, CT 06604",JobsOffice.org,https://JobsOffice.org,,https://www.twitter.com/taohq,
Connecticut,Fairfield,Bridgeport,#AnalyticsClub Virtual Job Fair / Career Expo Event #Bridgeport,https://www.eventbrite.com/e/analyticsclub-virtual-job-fair-career-expo-event-bridgeport-tickets-121111508783?aff=ebdssbdestsearch,,"Fri, Nov 3 •  11:00 AM  + 14 more","Virtual Event Only Virtual Event Only Bridgeport, CT 06604",TAO.ai,https://tao.ai,https://www.facebook.com/taoaihq,https://www.twitter.com/taohq,
Pennsylvania,Bucks,Langhorne,Crabfest 23',https://www.eventbrite.com/e/crabfest-23-tickets-718664333367?aff=ebdssbdestsearch,,"Sat, Oct 21 •  1:00 PM ","26 Ivy Court, Langhorne, PA, USA 26 Ivy Court Langhorne, PA 19047",,,,,
New Jersey,Burlington,Columbus,Craft N' More Fall Festival,https://www.eventbrite.com/e/craft-n-more-fall-festival-tickets-689689538977?aff=ebdssbdestsearch,,"Sat, Oct 21 •  10:00 AM ","Burlington County Fairgrounds 1990 Jacksonville Jobstown Road columbus, NJ 08022",KJ South Jersey Craft Fair,,https://www.facebook.com/groups/235410051694810/,,
Connecticut,Fairfield,Bethel,Bethel CT Pride's Annual Lgbtq+ Parade & Celebration,https://www.eventbrite.com/e/bethel-ct-prides-annual-lgbtq-parade-celebration-tickets-698681403887?aff=ebdssbdestsearch,,"Sat, Jun 1 •  12:00 PM ","Clifford J. Hurgin Municipal Center 1 School Street Bethel, CT 06801",Bethel CT Pride,http://bethelctpride.com,https://www.facebook.com/bethelctpride,https://www.twitter.com/bethelctpride,
New Jersey,Burlington,Columbus,Craft N' More Dessert Crawl,https://www.eventbrite.com/e/craft-n-more-dessert-crawl-tickets-714161425047?aff=ebdssbdestsearch,,"Sat, Oct 21 •  10:00 AM ","Burlington County Fairgrounds 1990 Jacksonville Jobstown Road Springfield, NJ 08022",KJ South Jersey Craft Fair,,https://www.facebook.com/groups/235410051694810/,,
Connecticut,Fairfield,Danbury,Fall Whiskey Fest,https://www.eventbrite.com/e/fall-whiskey-fest-tickets-695389166717?aff=ebdssbdestsearch,,,"Stew Leonard's Wines & Spirits of Danbury 2 Nabby Road Danbury, CT 06811",Stew Leonard's Wines & Spirits of Danbury,,,,
Connecticut,Fairfield,Bridgeport,TRUNK-OR-TREAT,https://www.eventbrite.com/e/trunk-or-treat-tickets-688569288277?aff=ebdssbdestsearch,,Saturday • 3:00 PM,"391 E Washington Ave 391 East Washington Avenue Bridgeport, CT 06608",Xsavier Lopez,,,,
New Jersey,Burlington,Browns Mills,Yule: Holidays Throughout Time,https://www.eventbrite.com/e/yule-holidays-throughout-time-tickets-736635134517?aff=ebdssbdestsearch,,"Sat, Dec 9 •  10:00 AM ","Historic Whitesbog Village 120 West Whites Bogs Road Browns Mills, NJ 08015",Whitesbog Preservation Trust,http://www.whitesbog.org/,https://www.facebook.com/whitesbog.preservationtrust,https://www.twitter.com/whitesbog,
Pennsylvania,Northampton,Easton,Bark & Boo Fest,https://www.eventbrite.com/e/bark-boo-fest-tickets-709499932397?aff=ebdssbdestsearch,,"Sat, Oct 21 •  11:00 AM ","Palmer Park Mall 123 Palmer Park Mall Easton, PA 18045",Blue Flame Events,https://www.blueflameevents.co,,,
Pennsylvania,Northampton,Pen Argyl,Fallmas Festival,https://www.eventbrite.com/e/fallmas-festival-tickets-709514536077?aff=ebdssbdestsearch,,"Sat, Nov 18 •  10:00 AM ","South Robinson Avenue, Pen Argyl, PA, USA South Robinson Avenue Pen Argyl, PA 18072",Blue Flame Events,https://www.blueflameevents.co,,,
Connecticut,Fairfield,Bethel,Lions Club Of Bethel Presents Octoberfeast 2023,https://www.eventbrite.com/e/lions-club-of-bethel-presents-octoberfeast-2023-tickets-726356861927?aff=ebdssbdestsearch,,Saturday • 3:00 PM,"Bennett Memorial Park, Shelter Rock Road, Bethel, CT, USA 14 Shelter Rock Road Bethel, CT 06801",Lions Club of Bethel,,,,
Pennsylvania,Bucks,Bristol,Bristol Borough Sunday Stroll,https://www.eventbrite.com/e/bristol-borough-sunday-stroll-tickets-479987735237?aff=ebdssbdestsearch,,"Sun, Oct 29 •  12:00 PM ","Mill Street Mill Street Bristol, PA 19007",State Street Events,,https://www.facebook.com/allamericanhomecare,,
Pennsylvania,Northampton,Pen Argyl,Holly Jolly Holiday Festival & Tricky Tray,https://www.eventbrite.com/e/holly-jolly-holiday-festival-tricky-tray-tickets-709627594237?aff=ebdssbdestsearch,,"Sat, Dec 9 •  10:00 AM ","Slate Belt YMCA, West Pennsylvania Avenue, Pen Argyl, PA, USA 315 West Pennsylvania Avenue Pen Argyl, PA 18072",Blue Flame Events,https://www.blueflameevents.co,,,
Connecticut,Fairfield,Brookfield,Second Annual Harvest Moon Craft Fair,https://www.eventbrite.com/e/second-annual-harvest-moon-craft-fair-tickets-675982440677?aff=ebdssbdestsearch,,"Sat, Nov 18 •  11:00 AM ","291 Federal Rd 291 Federal Road Brookfield, CT 06804",The Linden at Brookfield,,,,
Pennsylvania,Bucks,Doylestown,Spooktacular Costume Contest & Trick or Treating,https://www.eventbrite.com/e/spooktacular-costume-contest-trick-or-treating-tickets-664597327497?aff=ebdssbdestsearch,,"Sat, Oct 28 •  9:30 AM ","Bucks County Administration Front Lawn 55 E Court Street Doylestown, PA 18901",Discover Doylestown,https://www.discoverdoylestown.org/,https://www.facebook.com/DiscoverDoylestownDBCA,https://www.twitter.com/doylestowndbca,
Connecticut,New Haven,Milford,Mani-Fest Your Beauty Fest,https://www.eventbrite.com/e/mani-fest-your-beauty-fest-tickets-705547610897?aff=ebdssbdestsearch,,"Sat, Oct 21 •  12:00 PM ","The Reign 240 Naugatuck Avenue Milford, CT 06460",Manifest Beauty Entertainment,https://www.ManifestBeauty.TV,https://www.facebook.com/events/602284439931053,,
New York,Ulster,Milton,Fjord Hocus Pocus,https://www.eventbrite.com/e/fjord-hocus-pocus-tickets-728407565637?aff=ebdssbdestsearch,,"Fri, Oct 20 •  6:00 PM ","Fjord Vineyards, Ridge Road, Milton, NY, USA 251 Ridge Road Milton, NY 12547",Talk Chalk 2 Sue,,,,
New York,Suffolk,Yaphank,Christmas Craft Fair,https://www.eventbrite.com/e/christmas-craft-fair-tickets-638394774957?aff=ebdssbdestsearch,,"Sat, Nov 4 •  10:00 AM ","Integrity Church 1 Old Dock Road Yaphank, NY 11980",Camp Indigo,,,,
Connecticut,Fairfield,Newtown,The Newtown Record Riot! A Giant Vinyl Record Sale! CDs too.,https://www.eventbrite.com/e/the-newtown-record-riot-a-giant-vinyl-record-sale-cds-too-tickets-722705901807?aff=ebdssbdestsearch,,"Sun, Oct 22 •  10:00 AM ","Edmond Town Hall 45 Main Street Newtown, CT 06470",Record Riots,,https://www.facebook.com/recordriots,https://www.twitter.com/@irisrecsjc,
Connecticut,Fairfield,Newtown,Yule Film Fest - a holiday-inspired film festival,https://www.eventbrite.com/e/yule-film-fest-a-holiday-inspired-film-festival-tickets-700808867187?aff=ebdssbdestsearch,,"Sun, Nov 26 •  3:30 PM ","Edmond Town Hall 45 Main Street Newtown, CT 06470",Hartford Film Club,https://hartfordfilmclub.com/,https://www.facebook.com/110792813848034,,
Connecticut,Fairfield,Newtown,Hawley Fathers Club Pumpkin Carving 2023,https://www.eventbrite.com/e/hawley-fathers-club-pumpkin-carving-2023-tickets-715334373367?aff=ebdssbdestsearch,,"Wed, Oct 18 •  6:00 PM ","Hawley Elementary School 29 Church Hill Road Newtown, CT 06470",Hawley Father's Club,,,,
New York,Dutchess,Poughquag,"Beer, Whiskey, & Wine 2023",https://www.eventbrite.com/e/beer-whiskey-wine-2023-tickets-728976336847?aff=ebdssbdestsearch,,"Sat, Nov 4 •  1:00 PM ","Barton Orchards 63 Apple Tree Lane Poughquag, NY 12570",Townsquare Media,,,,
New York,Dutchess,Poughkeepsie,11th Annual Old-Fashioned Cider Tasting at the Kimlin Cider Mill,https://www.eventbrite.com/e/11th-annual-old-fashioned-cider-tasting-at-the-kimlin-cider-mill-tickets-706373721817?aff=ebdssbdestsearch,,Saturday • 11:00 AM,"Kimlin Cider Mill 140 Cedar Avenue Poughkeepsie, NY 12603",Cider Mill Friends,https://cidermillfriends.org/,https://www.facebook.com/kimlincidermillfriends,,
Pennsylvania,Bucks,Warrington,"Psychic, Healing, & Vendor Fair",https://www.eventbrite.com/e/psychic-healing-vendor-fair-tickets-694976181467?aff=ebdssbdestsearch,,"Sat, Oct 21 •  11:00 AM ","Inspiring Synergy Healing Arts Center 1352 Easton Road Warrington, PA 18976",Margaret Phillips,http://angelsalwaysaroundus.com,https://www.facebook.com/AngelsAlwaysAroundUs,https://www.twitter.com/@angelMargaretp,
Pennsylvania,Bucks,Warminster,Food festival cakes and pastries are extremely delicious,https://www.eventbrite.com/e/food-festival-cakes-and-pastries-are-extremely-delicious-tickets-734467551217?aff=ebdssbdestsearch,,"Fri, Aug 23 •  5:00 PM ","811 Sweetbriar Dr, Warminster, PA 18974, USA 811 Sweetbriar Drive Warminster, PA 18974",,,,,
Pennsylvania,Bucks,Perkasie,Horse Drawn Wagon Rides in the Vineyard,https://www.eventbrite.com/e/horse-drawn-wagon-rides-in-the-vineyard-tickets-715641712627?aff=ebdssbdestsearch,,Saturday • 1:00 PM,"Bishop Estate Vineyard and Winery 2730 Hilltown Pike Perkasie, PA 18944",Bishop Estate Vineyard and Winery,,https://www.facebook.com/Bishopestatewinery,https://www.twitter.com/CindyBishop711,
Pennsylvania,Bucks,Perkasie,Black Friday & Saturday Vendor + Craft Fair at Bishop Estate,https://www.eventbrite.com/e/black-friday-saturday-vendor-craft-fair-at-bishop-estate-tickets-729327336697?aff=ebdssbdestsearch,,"Fri, Nov 24 •  11:00 AM ","Bishop Estate Vineyard and Winery 2730 Hilltown Pike Perkasie, PA 18944",Bishop Estate Vineyard and Winery,,https://www.facebook.com/Bishopestatewinery,https://www.twitter.com/CindyBishop711,
New York,Dutchess,Poughkeepsie,Poughkeepsie Harvest Fest 2023,https://www.eventbrite.com/e/poughkeepsie-harvest-fest-2023-tickets-708616760807?aff=ebdssbdestsearch,,Saturday • 3:00 PM,"The Environmental Cooperative at the Vassar Barns 50 Vassar Farm Lane Poughkeepsie, NY 12603",Poughkeepsie Farm Project,http://www.farmproject.org,,,
Connecticut,New Haven,Milford,Laura's Treasure Trove .......HALF PRICE SALE !!!..,https://www.eventbrite.com/e/lauras-treasure-trove-half-price-sale-tickets-719492881577?aff=ebdssbdestsearch,,"Sat, Oct 21 •  9:30 AM ","168 Broad St 168 Broad Street Milford, CT 06460",Paul Downing,,,,
New York,Dutchess,Poughkeepsie,5th Annual Samhain Oddities & Curiosities Night Market,https://www.eventbrite.com/e/5th-annual-samhain-oddities-curiosities-night-market-tickets-698682186227?aff=ebdssbdestsearch,,Friday • 6:00 PM,"Revel 32 32 Cannon Street Poughkeepsie, NY 12601","Moon, Serpent and Bone",,,,
Connecticut,New Haven,Derby,Smoke in the Valley Craft Beer and HomeBrew Festival,https://www.eventbrite.com/e/smoke-in-the-valley-craft-beer-and-homebrew-festival-tickets-649446290337?aff=ebdssbdestsearch,,"Sat, Oct 21 •  1:00 PM ","BADSONS Beer Co. 251 Roosevelt Drive Derby, CT 06418","The Sound Magazine, LLC",,,,
Pennsylvania,Monroe,Saylorsburg,4th Annual Harvest Wine Festival,https://www.eventbrite.com/e/4th-annual-harvest-wine-festival-tickets-706408435647?aff=ebdssbdestsearch,,Saturday • 12:00 PM,"Stone Lake Inn 407 Greenview Drive Saylorsburg, PA 18353",Stone Lake Winery,,,,
New York,Ulster,Highland,Bad Santa Con,https://www.eventbrite.com/e/bad-santa-con-tickets-707908371997?aff=ebdssbdestsearch,,"Sat, Dec 16 •  3:00 PM ","Bad Seed Cider Co. 43 Baileys Gap Rd Highland, NY 12528",Bad Seed Cider Company,http://www.BadSeedHardCider.com,https://www.facebook.com/badseedcider,https://www.twitter.com/badseedcider,
,,,Philadelphia African Restaurant Week 2023,https://www.eventbrite.com/e/philadelphia-african-restaurant-week-2023-tickets-569635634517?aff=ebdssbdestsearch,,"Mon, Oct 23 •  12:00 PM ","Philadelphia Philadelphia Philadelphia, PA 19019",African Restaurant Week,http://africanrestaurantweek.com,https://www.facebook.com/nyafricanrestaurantweek,,
Pennsylvania,Bucks,Chalfont,Farm Fall Fest at Coleman Hay Farms,https://www.eventbrite.com/e/farm-fall-fest-at-coleman-hay-farms-tickets-685670919177?aff=ebdssbdestsearch,,Saturday • 10:00 AM + 44 more,"138 Walter Rd 138 Walter Road Chalfont, PA 18914",Coleman Hay Farms,,,,
Pennsylvania,Northampton,Bethlehem,The Wicked World's Fair,https://www.eventbrite.com/e/the-wicked-worlds-fair-tickets-658250965357?aff=ebdssbdestsearch,,"Fri, Feb 23 •  3:00 PM ","SureStay Plus By Best Western Lehigh Valley 300 Gateway Drive Bethlehem, PA 18017",Jeff Mach Events,https://halloweenvendorandodditiesmarket.com/,https://www.facebook.com/thatjeffmach,https://www.twitter.com/darklordjournal,
New York,Ulster,New Paltz,Spookapalooza/FryteFest,https://www.eventbrite.com/e/spookapaloozafrytefest-tickets-650182321827?aff=ebdssbdestsearch,,"Fri, Oct 20 •  6:00 PM ","Ulster County Fairgrounds 249 Libertyville Road New Paltz, NY 12561",Mystik Bazaar,,https://www.facebook.com/HVpiratefestival,,
Pennsylvania,Philadelphia,Philadelphia,Christmas Village - Vendor Application,https://www.eventbrite.com/e/christmas-village-vendor-application-tickets-692114582347?aff=ebdssbdestsearch,,"Sat, Dec 16 •  12:00 PM ","9130 Academy Rd 9130 Academy Road Philadelphia, PA 19114",Peg Wilson,,,,
Pennsylvania,Bucks,Quakertown,Quakertown Parks and Recreation  Fall Festival and Trunk or Treat,https://www.eventbrite.com/e/quakertown-parks-and-recreation-fall-festival-and-trunk-or-treat-tickets-722047382157?aff=ebdssbdestsearch,,Saturday • 2:00 PM,"The Park at 4th (Univest Performance Center), West Mill Street, Quakertown, PA, USA 301 West Mill Street Quakertown, PA 18951",Quakertown Borough Parks and Recreation,https://www.quakertown.org/government/parks-recreation,,,
Pennsylvania,Montgomery,Horsham,BFC Family - Movie Ministry  & Fellowship!,https://www.eventbrite.com/e/bfc-family-movie-ministry-fellowship-tickets-66773101143?aff=ebdssbdestsearch,,Sunday • 5:00 PM + 61 more,"BFC Movie Ministry - Resident Theater 413 Avenue E Horsham, PA 19044",BFC Family - Believing Faithfully In-Christ,https://bfcfamily-believingfaithfullyinchrist.com,https://www.facebook.com/BFCBelieving,,
Pennsylvania,Philadelphia,Philadelphia,Christmas Village,https://www.eventbrite.com/e/christmas-village-tickets-692090239537?aff=ebdssbdestsearch,,"Sat, Dec 16 •  12:00 PM ","9130 Academy Rd 9130 Academy Road Philadelphia, PA 19114",Peg Wilson,,,,
Pennsylvania,Philadelphia,Philadelphia,CURIOSITIES FESTIVAL,https://www.eventbrite.com/e/curiosities-festival-tickets-719205251267?aff=ebdssbdestsearch,,"Sat, May 4 •  12:00 PM ","Cannstatter Volksfest Verein 9130 Academy Road Philadelphia, PA 19114",K & P EXPRESSIVE EVENTS,,,,
Connecticut,New Haven,Southbury,Community Farmfest: Harvest of Togetherness,https://www.eventbrite.com/e/community-farmfest-harvest-of-togetherness-registration-731390788537?aff=ebdssbdestsearch,,"Sat, Oct 28 •  1:00 PM ","655 N Georges Hill Rd 655 North Georges Hill Road Southbury, CT 06488",Unfold Farm,,,,
Pennsylvania,Bucks,Quakertown,Autumn Alive!,https://www.eventbrite.com/e/autumn-alive-tickets-718589188607?aff=ebdssbdestsearch,,"Sat, Oct 21 •  10:00 AM ","West Broad Street West Broad Street Quakertown, PA 18951",Quakertown Alive,,,,
Pennsylvania,Monroe,Gilbert,The Electrifying Jack O Lantern Experience,https://www.eventbrite.com/e/the-electrifying-jack-o-lantern-experience-tickets-689595066407?aff=ebdssbdestsearch,,Tomorrow • 7:00 PM + 61 more,"West End Fair Association 570 Fairground Road Gilbert, PA 18331",Marathon Bar Events LLC,,,,
Pennsylvania,Lehigh,Center Valley,Barktoberfest Howl-O-Ween Pet Costume Contest,https://www.eventbrite.com/e/barktoberfest-howl-o-ween-pet-costume-contest-tickets-733810315407?aff=ebdssbdestsearch,,"Sat, Oct 21 •  12:00 PM ","The Promenade Shops at Saucon Valley 2845 Center Valley Parkway Upper Saucon Township, PA 18034",The Promenade Shops at Saucon Valley,,,,
Pennsylvania,Philadelphia,Philadelphia,MAYFAIR CHRISTMAS VILLAGE & TREE LIGHTING,https://www.eventbrite.com/e/mayfair-christmas-village-tree-lighting-tickets-734837377377?aff=ebdssbdestsearch,,"Sun, Dec 3 •  2:00 PM ","Cottman Av & Frankford Av - FS Cottman and Frankford Philadelphia, PA 19149",State Street Events,,https://www.facebook.com/allamericanhomecare,,
Pennsylvania,Lehigh,Allentown,"HOLIDAY EXTRAVAGANZA 2023 / 2024. ARTS, CRAFTS, & MORE!",https://www.eventbrite.com/e/holiday-extravaganza-2023-2024-arts-crafts-more-tickets-707866546897?aff=ebdssbdestsearch,,"Sat, Nov 4 •  12:00 AM ","DAYS HOTEL 3400 Airport Road Allentown, PA 18109",,,,,
Connecticut,New Haven,West Haven,Taste of West Haven 2023,https://www.eventbrite.com/e/taste-of-west-haven-2023-tickets-730809058567?aff=ebdssbdestsearch,,"Sat, Nov 4 •  4:00 PM ","West Haven Elks Lodge, Main Street, West Haven, CT, USA 265 Main Street West Haven, CT 06516",Rotary Club of West Haven,http://www.westhavenrotary.org,,,
Connecticut,New Haven,Southbury,10th New Age & Craft Expo,https://www.eventbrite.com/e/10th-new-age-craft-expo-tickets-656199970777?aff=ebdssbdestsearch,,"Sun, Nov 5 •  10:00 AM ","Wyndham Southbury 1284 Strongtown Road Southbury, CT 06488",Creatively Yours,,https://www.facebook.com/New-Age-Craft-Expo-724103394360582,,
Pennsylvania,Philadelphia,Philadelphia,Now + Then Marketplace Holiday Gifts Galore Market,https://www.eventbrite.com/e/now-then-marketplace-holiday-gifts-galore-market-registration-706254986677?aff=ebdssbdestsearch,,"Fri, Dec 1 •  5:00 PM ","The Frankford Arsenal 2275 Bridge Street Philadelphia, PA 19137",A Steph Irwin Event,,https://www.facebook.com/stephirwinevent,,
Pennsylvania,Philadelphia,Philadelphia,"All Hallows' Dream ,  A One Night Music &  Art Fest.",https://www.eventbrite.com/e/all-hallows-dream-a-one-night-music-art-fest-tickets-604297278427?aff=ebdssbdestsearch,,Friday • 6:00 PM,"Redwine Nightclub & Restaurant 701 Adams Avenue Philadelphia, PA 19124",CarbonKitty,,,,
Pennsylvania,Philadelphia,Philadelphia,Frankford CDC Fall Festival,https://www.eventbrite.com/e/frankford-cdc-fall-festival-tickets-733420178497?aff=ebdssbdestsearch,,"Sat, Oct 21 •  11:00 AM ","Frankford Pause Park 4673 Paul Street Philadelphia, PA 19124",Frankford Community Development Corporation,http://frankfordcdc.org,https://www.facebook.com/FrankfordCDC215,https://www.twitter.com/fcdc215,
Pennsylvania,Montgomery,North Wales,Fall Fest,https://www.eventbrite.com/e/fall-fest-tickets-728512649947?aff=ebdssbdestsearch,,"Sat, Oct 21 •  11:00 AM ","1 Parkside Pl 1 Parkside Place North Wales, PA 19454",Upper Gwynedd Township Parks and Recreation,,,,
Pennsylvania,Montgomery,Ambler,Food Truck SATURDAY 10/21/2023,https://www.eventbrite.com/e/food-truck-saturday-10212023-tickets-603953229367?aff=ebdssbdestsearch,,"Sat, Oct 21 •  1:00 PM ","Ambler Yards 300 Brookside Avenue Ambler, PA 19002",Well Crafted Beer Co.,http://www.wellcraftedbeer.com/,https://www.facebook.com/wellcraftedambler,,
Pennsylvania,Montgomery,North Wales,Holiday Lights Celebration,https://www.eventbrite.com/e/holiday-lights-celebration-tickets-731413376097?aff=ebdssbdestsearch,,"Fri, Dec 1 •  6:00 PM ","1 Parkside Pl 1 Parkside Place North Wales, PA 19454",Upper Gwynedd Township Parks and Recreation,,,,
Pennsylvania,Lehigh,Emmaus,First Annual Harvest for Veterans at the Knauss Homestead,https://www.eventbrite.com/e/first-annual-harvest-for-veterans-at-the-knauss-homestead-registration-727582477777?aff=ebdssbdestsearch,,"Sat, Oct 21 •  1:00 PM ","The Knauss Homestead 152 East Main Street Emmaus, PA 18049",The Knauss Homestead Preservation Society,https://www.knausshomestead.org,https://www.facebook.com/KnaussHomestead,,
Pennsylvania,Montgomery,Fort Washington,1777 Whitemarsh Encampment Reenactment  Historic Hope Lodge- Ft Washington,https://www.eventbrite.com/e/1777-whitemarsh-encampment-reenactment-historic-hope-lodge-ft-washington-tickets-734702473877?aff=ebdssbdestsearch,,"Sat, Nov 4 •  10:00 AM ","Historic Hope Lodge 553 South Bethlehem Pike Fort Washington, PA 19034",Friends of Hope Lodge,,,,
Pennsylvania,Philadelphia,Philadelphia,Fall Flea Market (pop up shop),https://www.eventbrite.com/e/fall-flea-market-pop-up-shop-tickets-731806742667?aff=ebdssbdestsearch,,"Sat, Oct 21 •  9:00 AM ","5925 Old York Rd 5925 Old York Road Philadelphia, PA 19141",Owner of Private Beauty Lounge,,,,
Pennsylvania,Philadelphia,Philadelphia,Olney Youth Arts Festival,https://www.eventbrite.com/e/olney-youth-arts-festival-tickets-606900926007?aff=ebdssbdestsearch,,"Sat, Nov 4 •  12:00 PM ","Thurgood Marshall Elementary School 5120 North 6th St. Philadelphia, PA 19120",Olney Culture Lab of CultureTrust Greater Phila,https://olneyculturelab.org/,,,
Pennsylvania,Carbon,Palmerton,CBI Fall Fest,https://www.eventbrite.com/e/cbi-fall-fest-tickets-727540271537?aff=ebdssbdestsearch,,"Sat, Oct 21 •  12:00 PM ","4300 Little Gap Road, Palmerton, PA, USA 4300 Little Gap Road Palmerton, PA 18071",CBI Fest,,,,
Connecticut,New Haven,New Haven,Change in the Air Festival,https://www.eventbrite.com/e/change-in-the-air-festival-tickets-665717568167?aff=ebdssbdestsearch,,"Sat, Oct 28 •  12:00 PM ","470 James St 470 James Street New Haven, CT 06513",The Change in the Air Foundation,,,,
Connecticut,New Haven,New Haven,Oktoberfest 2023,https://www.eventbrite.com/e/oktoberfest-2023-tickets-726251587047?aff=ebdssbdestsearch,,"Sat, Oct 21 •  2:00 PM ","Bear's Smokehouse Barbecue 470 James Street New Haven, CT 06513",Bear's Smokehouse BBQ,https://www.bearsbbq.com,https://www.facebook.com/bearsbbq,https://www.twitter.com/bearssmokehouse,
Pennsylvania,Philadelphia,Philadelphia,PICC FALL FEST,https://www.eventbrite.com/e/picc-fall-fest-tickets-705562415177?aff=ebdssbdestsearch,,"Sat, Oct 28 •  12:00 PM ","4221 N 2nd St 4221 North 2nd Street Philadelphia, PA 19140",Jen Fischer,,https://www.facebook.com/PhilaICC,https://www.twitter.com/PhilaICC,
New Jersey,Camden,Cherry Hill,CHPL  Holiday Craft Fair - Vendor Registration,https://www.eventbrite.com/e/chpl-holiday-craft-fair-vendor-registration-tickets-730483895997?aff=ebdssbdestsearch,,"Sun, Nov 19 •  1:00 PM ","Cherry Hill Public Library 1100 Kings Hwy N Cherry Hill, NJ 08034",Cherry Hill Public Library,http://www.chplnj.org,https://www.facebook.com/CHPLNJ,https://www.twitter.com/@CHPLibrary,
Pennsylvania,Philadelphia,Philadelphia,Oktoberfest: 420 Edition,https://www.eventbrite.com/e/oktoberfest-420-edition-tickets-734169991207?aff=ebdssbdestsearch,,Sunday • 1:00 PM,"Ogontz Avenue & Lindley Avenue Ogontz and Lindley Philadelphia, PA 19112",@kwalker_events,,,,https://www.instagram.com/kwalker_events/
Pennsylvania,Philadelphia,Philadelphia,Jabali Farmers Market,https://www.eventbrite.com/e/jabali-farmers-market-tickets-643255563707?aff=ebdssbdestsearch,,"Sat, Oct 21 •  10:00 AM ","Avenues Café 7201 Germantown Avenue Philadelphia, PA 19119",Black + Planted,Http://www.blackandplanted.com,https://www.facebook.com/BlackandPlanted,,
Pennsylvania,Philadelphia,Philadelphia,Stenton's Halloween Harvest Festival,https://www.eventbrite.com/e/stentons-halloween-harvest-festival-tickets-717189672617?aff=ebdssbdestsearch,,"Sat, Oct 28 •  1:00 PM ","4601 N 18th St 4601 North 18th Street Philadelphia, PA 19140",Stenton,,https://www.facebook.com/stentonmuseum,,
Connecticut,New Haven,East Haven,Brewed In Post Film & Music Festival,https://www.eventbrite.com/e/brewed-in-post-film-music-festival-tickets-638711923557?aff=ebdssbdestsearch,,Friday • 5:00 PM,"The Beeracks 250 Bradley Street East Haven, CT 06512",The Art Jam Collective,https://www.artjamcollective.com,https://www.facebook.com/artjamnow,,
Connecticut,New Haven,East Haven,Pumpkin Patch at The Shore Line Trolley Museum,https://www.eventbrite.com/e/pumpkin-patch-at-the-shore-line-trolley-museum-registration-716390111107?aff=ebdssbdestsearch,,Saturday • 11:00 AM,"The Shore Line Trolley Museum 17 River Street East Haven, CT 06512",The Shore Line Trolley Museum,https://www.shorelinetrolley.org,https://www.facebook.com/1879496355563,https://www.twitter.com/sltrolley,
Pennsylvania,Montgomery,Harleysville,Holiday Marketplace of Harleysville,https://www.eventbrite.com/e/holiday-marketplace-of-harleysville-tickets-698539419207?aff=ebdssbdestsearch,,"Sat, Nov 11 •  10:00 AM ","2211 Mainland Rd 2211 Mainland Road Harleysville, PA 19438",Holiday Marketplace at Christ Lutheran Church,https://www.harleysvilleholiday.com/,,,
New York,Sullivan,Loch Sheldrake,SUNY Sullivan Holiday Craft Fair - Vendor Application,https://www.eventbrite.com/e/suny-sullivan-holiday-craft-fair-vendor-application-registration-722257540747?aff=ebdssbdestsearch,,"Sun, Nov 12 •  10:00 AM ","SUNY Sullivan 112 College Road Loch Sheldrake, NY 12759",SUNY Sullivan,https://sunysullivan.edu,https://www.facebook.com/175866219095885,https://www.twitter.com/suny_sullivan,
Connecticut,New Haven,Naugatuck,"A Psychic Fair - Samhain Halloween - Tarot, Psychics, Vendors (Oct 14)",https://www.eventbrite.com/e/a-psychic-fair-samhain-halloween-tarot-psychics-vendors-oct-14-tickets-676896253917?aff=ebdssbdestsearch,,Saturday • 12:00 PM,"Naugatuck Portuguese Club (Connecticut) 110 Rubber Avenue Naugatuck, CT 06770",The Tarot Goddess LLC,,,,
New York,Ulster,Stone Ridge,AppleFest,https://www.eventbrite.com/e/applefest-registration-719299974587?aff=ebdssbdestsearch,,"Sat, Oct 21 •  3:00 PM ","Stone Ridge Orchard 3012 New York 213 Stone Ridge, NY 12484",The Vanaver Caravan,https://www.vanavercaravan.org,,,
