State,County,City,Title,Link,Price,Date Time,Location,Organiser,Website Link,Facebook Link,Twitter Link,Instagram Link
New Jersey,Hudson,Hoboken,Main Street Pops Fall Artisan Markets,https://www.eventbrite.com/e/main-street-pops-fall-artisan-markets-tickets-714882040427?aff=ebdssbdestsearch,,Sunday • 11:00 AM + 1 more,"Under 14th Street Viaduct 1401 Adam’s street Hoboken, NJ 07030",Main Street Pops,,https://www.facebook.com/Main-Street-Pops-124746958920017,,
New York,New York,New York,Weaving Cultures,https://www.eventbrite.com/e/weaving-cultures-tickets-734886895487?aff=ebdssbdestsearch,,Today • 6:00 PM,"86 Orchard Street, New York, NY, USA 86 Orchard Street New York, NY 10002",Casa Mezcal & Amantes Social Club,https://www.casamezcalnyc.com/,https://www.facebook.com/256222531175822,,
New York,Kings,Brooklyn,Plant-Based foods at  Smorgasburg  in Williamsburg,https://www.eventbrite.com/e/plant-based-foods-at-smorgasburg-in-williamsburg-tickets-622052063467?aff=ebdssbdestsearch,,Saturday • 11:00 AM + 2 more,"90 Kent Ave 90 Kent Avenue Brooklyn, NY 11249",Chef Yesenia. Founder of Healthy As A Motha Dominican & Trinidadian,,,,
New Jersey,Essex,Newark,Artisan Farmers Market,https://www.eventbrite.com/e/artisan-farmers-market-tickets-653953170537?aff=ebdssbdestsearch,,Monday • 2:00 PM,"179 Broadway 179 Broadway Newark, NJ 07104",STEAM URBAN,https://www.steamurban.org,,,
New York,New York,New York,Intl Film Festival Manhattan Shorts Prog 3 Khatak Film Society Season 5,https://www.eventbrite.com/e/intl-film-festival-manhattan-shorts-prog-3-khatak-film-society-season-5-tickets-735772624727?aff=ebdssbdestsearch,,Saturday • 4:15 PM,"LOOK Dine-In Cinemas W57 657 West 57th Street New York, NY 10019",Luis Pedron,,https://www.facebook.com/LuisPedron,https://www.twitter.com/IFFMNewYork,
New York,Queens,Long Island City,Fall Festival,https://www.eventbrite.com/e/fall-festival-tickets-736776778177?aff=ebdssbdestsearch,,"Fri, Oct 20 •  2:00 PM ","The Learning Experience at Long Island City 27-28 Thomson Avenue Long Island City, NY 11101",The Learning Experience at LIC,,,,
New York,Kings,Brooklyn,Shop Small & Brunch Saturdays,https://www.eventbrite.com/e/shop-small-brunch-saturdays-tickets-538114343487?aff=ebdssbdestsearch,,Saturday • 1:00 PM + 9 more,"333 Flatbush Ave 333 Flatbush Avenue Brooklyn, NY 11217",333 The Small Business Svite,,,,
New York,Kings,Brooklyn,Karaoke * Brunch * Shop Black,https://www.eventbrite.com/e/karaoke-brunch-shop-black-tickets-559266159137?aff=ebdssbdestsearch,,Sunday • 1:00 PM + 10 more,"333 Flatbush Ave 333 Flatbush Avenue Brooklyn, NY 11217",333 The Small Business Svite,,,,
New Jersey,Middlesex,Edison,Diwali Sneh Milan,https://www.eventbrite.com/e/diwali-sneh-milan-tickets-720754515157?aff=ebdssbdestsearch,,"Fri, Nov 3 •  6:00 PM ","Royal Alberts Palace 1050 King Georges Post Road Edison, NJ 08837",Jhoom Events,,https://www.facebook.com/events/1807503709473397,,
New Jersey,Bergen,Woodcliff Lake,2023 PBA 206 Food Truck Festival,https://www.eventbrite.com/e/2023-pba-206-food-truck-festival-tickets-720748356737?aff=ebdssbdestsearch,,Sunday • 12:00 PM,"Tice's Corner Marketplace 441 Chestnut Ridge Road Woodcliff Lake, NJ 07677",Ryan Hansen,,,,
New York,Kings,Brooklyn,The Market at the Brooklyn Museum,https://www.eventbrite.com/e/the-market-at-the-brooklyn-museum-tickets-561021128297?aff=ebdssbdestsearch,,Sunday • 10:00 AM + 4 more,"Brooklyn Museum 200 Eastern Parkway Brooklyn, NY 11238",Brooklyn Pop-Up,http://www.brooklynpop-up.com,https://www.facebook.com/Brooklynpopup,,
New York,Kings,Brooklyn,FREE Films on Fulton,https://www.eventbrite.com/e/free-films-on-fulton-tickets-521394183037?aff=ebdssbdestsearch,,"Thu, Oct 26 •  7:30 PM  + 2 more","745 Fulton St 745 Fulton Street Brooklyn, NY 11217",Filming Real Emotional Experiences LLC,,https://www.facebook.com/100064854031835,https://www.twitter.com/free_studios1,https://www.instagram.com/f.r.e.e.studios/
New York,New York,New York,2023 Fungus Festival: Growing Mushrooms with Waste Materials/Mi Oh My Farms,https://www.eventbrite.com/e/2023-fungus-festival-growing-mushrooms-with-waste-materialsmi-oh-my-farms-tickets-735762554607?aff=ebdssbdestsearch,,Sunday • 11:00 AM,"11 Wards Meadow Loop 11 Wards Meadow Loop New York, NY 10035",Mi Oh My Farms,http://miohmyfarms.com,,https://www.twitter.com/miohmyfarms,
New York,Kings,Brooklyn,Big Dreams Child Care Center's Fall Festival!,https://www.eventbrite.com/e/big-dreams-child-care-centers-fall-festival-tickets-735423701087?aff=ebdssbdestsearch,,"Fri, Oct 27 •  4:00 PM ","3025 Avenue U, Brooklyn, NY, USA 3025 Avenue U Brooklyn, NY 11229",Big Dreams Child Care Center,,,,
New York,Kings,Brooklyn,BOOTH4NG at OPEN TROUTMAN STREETS  - BUSHWICK,https://www.eventbrite.com/e/booth4ng-at-open-troutman-streets-bushwick-tickets-712540546957?aff=ebdssbdestsearch,,Saturday • 2:00 PM + 2 more,"381 Troutman Street 381 Troutman Street Brooklyn, NY 11237",Pixelated Party,,https://www.facebook.com/PIXELATEDPARTY,,
New York,Queens,Ridgewood,Be There Film Festival,https://www.eventbrite.com/e/be-there-film-festival-tickets-731365081647?aff=ebdssbdestsearch,,"Sat, Dec 2 •  2:00 PM ","Windjammer Bar 552 Grandview Avenue Queens, NY 11385",Footlight Presents,,,,
New Jersey,Somerset,Warren,TLE Warren Fall Festival Trunk or Treat,https://www.eventbrite.com/e/tle-warren-fall-festival-trunk-or-treat-tickets-714291955467?aff=ebdssbdestsearch,,Saturday • 10:00 AM,"The Learning Experience Of Warren 76 Stirling Rd Warren, NJ 07059",The Learning Experience of Warren,,,,
New York,New York,New York,#Healthires Virtual Job Fair / Career Expo Event #NewYork #NYC,https://www.eventbrite.com/e/healthires-virtual-job-fair-career-expo-event-newyork-nyc-tickets-255853955067?aff=ebdssbdestsearch,,"Fri, Nov 3 •  11:00 AM  + 1 more","New York Virtual New York, NY 10007",JobsOffice.org,https://JobsOffice.org,,https://www.twitter.com/taohq,
New York,New York,New York,#RetailHires Virtual Job Fair / Career Expo Event #NewYork #NYC,https://www.eventbrite.com/e/retailhires-virtual-job-fair-career-expo-event-newyork-nyc-tickets-255459665737?aff=ebdssbdestsearch,,"Fri, Nov 3 •  11:00 AM  + 1 more","New York Virtual event New York, NY 10007",JobsOffice.org,https://JobsOffice.org,,https://www.twitter.com/taohq,
New York,New York,New York,#Auditors and #Advisors Virtual Job Fair / Career Expo Event #NewYork #NYC,https://www.eventbrite.com/e/auditors-and-advisors-virtual-job-fair-career-expo-event-newyork-nyc-tickets-257658311947?aff=ebdssbdestsearch,,"Fri, Nov 3 •  11:00 AM  + 1 more","New York Virtual event New York, NY 10007",JobsOffice.org,https://JobsOffice.org,,https://www.twitter.com/taohq,
New York,New York,New York,#Remote2dot0 Virtual Job Fair / Career Expo Event #NewYork #NYC,https://www.eventbrite.com/e/remote2dot0-virtual-job-fair-career-expo-event-newyork-nyc-tickets-257610388607?aff=ebdssbdestsearch,,"Fri, Nov 3 •  11:00 AM  + 1 more","New York Virtual New York, NY 10007",JobsOffice.org,https://JobsOffice.org,,https://www.twitter.com/taohq,
New York,New York,New York,#AnalyticsClub Virtual Job Fair / Career Expo Event #New York,https://www.eventbrite.com/e/analyticsclub-virtual-job-fair-career-expo-event-new-york-tickets-120566203761?aff=ebdssbdestsearch,,"Fri, Nov 3 •  11:00 AM  + 14 more","Virtual Event Only Virtual Event Only New York, NY 10007",TAO.ai,https://tao.ai,https://www.facebook.com/taoaihq,https://www.twitter.com/taohq,
New York,New York,New York,#TechnicianHires Virtual Job Fair / Career Expo Event #NewYork #NYC,https://www.eventbrite.com/e/technicianhires-virtual-job-fair-career-expo-event-newyork-nyc-tickets-255954606117?aff=ebdssbdestsearch,,"Fri, Nov 3 •  11:00 AM  + 1 more","Virtual Virtual New York, NY 10017",JobsOffice.org,https://JobsOffice.org,,https://www.twitter.com/taohq,
New York,New York,New York,#MechanicsPort Virtual Job Fair / Career Expo Event #NewYork #NYC,https://www.eventbrite.com/e/mechanicsport-virtual-job-fair-career-expo-event-newyork-nyc-tickets-256901939617?aff=ebdssbdestsearch,,"Fri, Nov 3 •  11:00 AM  + 1 more","New York Virtual New York, NY 10007",JobsOffice.org,https://JobsOffice.org,,https://www.twitter.com/taohq,
New York,New York,New York,#FoodServes Virtual Job Fair / Career Expo Event #NewYork #NYC,https://www.eventbrite.com/e/foodserves-virtual-job-fair-career-expo-event-newyork-nyc-tickets-256626987227?aff=ebdssbdestsearch,,"Fri, Nov 3 •  11:00 AM  + 1 more","New York Virtual New York, NY 10007",JobsOffice.org,https://JobsOffice.org,,https://www.twitter.com/taohq,
New York,New York,New York,#TechnicianHires Virtual Job Fair / Career Expo Event #Madison,https://www.eventbrite.com/e/technicianhires-virtual-job-fair-career-expo-event-madison-tickets-255964244947?aff=ebdssbdestsearch,,"Fri, Nov 3 •  11:00 AM  + 1 more","PricewaterhouseCoopers 300 Madison Venue #24 New York, NY 10017",JobsOffice.org,https://JobsOffice.org,,https://www.twitter.com/taohq,
New York,New York,New York,#MFGClub Virtual Job Fair / Career Expo Event #NewYork #NYC,https://www.eventbrite.com/e/mfgclub-virtual-job-fair-career-expo-event-newyork-nyc-tickets-256993904687?aff=ebdssbdestsearch,,"Fri, Nov 3 •  11:00 AM  + 1 more","New York Virtual Event Only New York, NY 10007",JobsOffice.org,https://JobsOffice.org,,https://www.twitter.com/taohq,
New York,New York,New York,#SanitationHires Virtual Job Fair / Career Expo Event #NewYork #NYC,https://www.eventbrite.com/e/sanitationhires-virtual-job-fair-career-expo-event-newyork-nyc-tickets-256231323787?aff=ebdssbdestsearch,,"Fri, Nov 3 •  11:00 AM  + 1 more","New York Virtual New York, NY 10007",JobsOffice.org,https://JobsOffice.org,,https://www.twitter.com/taohq,
New York,Kings,Brooklyn,FAD Market: Fall Pop-up [Dumbo],https://www.eventbrite.com/e/fad-market-fall-pop-up-dumbo-tickets-681058744037?aff=ebdssbdestsearch,,"Sat, Nov 4 •  11:00 AM  + 1 more","55 Water St 55 Water Street Brooklyn, NY 11201",FAD Market,http://www.fadmarket.co,https://www.facebook.com/fadmarket,https://www.twitter.com/fadmarket,
New York,Queens,Far Rockaway,2023 Children's Harvest Festival at Far Rockaway Farms,https://www.eventbrite.com/e/2023-childrens-harvest-festival-at-far-rockaway-farms-tickets-695446387867?aff=ebdssbdestsearch,,Saturday • 1:00 PM,"Far Rockaway Farm 385 B 45 St Queens, NY 11691",The Campaign Against Hunger,,,,
New York,Queens,Jamaica,ANNUAL HEALTH FAIR,https://www.eventbrite.com/e/annual-health-fair-tickets-732804958357?aff=ebdssbdestsearch,,Saturday • 10:00 AM,"182-10 Liberty Avenue, St. Albans, NY 11412 182-10 Liberty Avenue Queens, NY 11433",Fresh Anointing International Church,,https://www.facebook.com/FreshanointingOrg,https://www.twitter.com/@freshanointing_,
New Jersey,Morris,Morristown,Morristown Marketplace: Craft & Vendor Fair,https://www.eventbrite.com/e/morristown-marketplace-craft-vendor-fair-tickets-719616461207?aff=ebdssbdestsearch,,"Sun, Oct 22 •  1:00 PM ","St. Peter's Episcopal Church 70 Maple Avenue Morristown, NJ 07960",Brilliant Conventions,,,,
New York,New York,New York,Diwali Celebration at the Seaport,https://www.eventbrite.com/e/diwali-celebration-at-the-seaport-tickets-734802332557?aff=ebdssbdestsearch,,"Fri, Nov 10 •  3:00 PM ","Seaport Square at Pier 17 89 South Street New York, NY 10038",The Seaport,https://theseaport.nyc/,https://www.facebook.com/seaportdistrict.nyc,,
New Jersey,Union,Plainfield,Dia Especial de Nuestra Hispanidad,https://www.eventbrite.com/e/entradas-dia-especial-de-nuestra-hispanidad-733949511747?aff=ebdssbdestsearch,,"Sat, Oct 21 •  7:30 PM ","Casa de Oración Restoration 705 Park Avenue #suite 209 210 Plainfield, NJ 07060",Casa de Oración Restoration Center,,,,https://www.instagram.com/casadeoracion_rc/
New York,Queens,Long Island City,NYC DOHMH Registered Nurse Career and Networking Event - 11/14/2023,https://www.eventbrite.com/e/nyc-dohmh-registered-nurse-career-and-networking-event-11142023-tickets-696082069207?aff=ebdssbdestsearch,,"Tue, Nov 14 •  10:00 AM ","42-09 28th St 42-09 28th Street Queens, NY 11101",New York City Department of Health and Mental Hygiene,http://www1.nyc.gov/site/doh/index.page,,,
New York,Queens,Glen Oaks,Girl Code NYC Queens Ambassadors Present :  Pick Your Pumpkin Patch,https://www.eventbrite.com/e/girl-code-nyc-queens-ambassadors-present-pick-your-pumpkin-patch-tickets-733968468447?aff=ebdssbdestsearch,,"Sun, Oct 22 •  1:00 PM ","Queens County Farm Museum 73-50 Little Neck Parkway Queens, NY 11004",Girl Code NYC,,,,https://www.instagram.com/girlcode_nyc/
New York,Bronx,Bronx,Advanced Math & Science II Open House,https://www.eventbrite.com/e/advanced-math-science-ii-open-house-tickets-735561031847?aff=ebdssbdestsearch,,"Sat, Nov 4 •  11:00 AM ","900 Tinton Avenue, The Bronx, NY, USA 900 Tinton Avenue The Bronx, NY 10456",Family & Student Engagement Team,,,,
New York,Westchester,Yonkers,Whiskey Fest,https://www.eventbrite.com/e/whiskey-fest-tickets-710289283367?aff=ebdssbdestsearch,,"Sat, Oct 21 •  12:00 PM ","Stew Leonard's Wines & Spirits of Yonkers 1 Stew Leonard Drive ##1 Yonkers, NY 10710",Stew Leonard's Wines & Spirits of Yonkers,,,,
New Jersey,Middlesex,Edison,Fine Arts and Crafts Show,https://www.eventbrite.com/e/fine-arts-and-crafts-show-tickets-643012837707?aff=ebdssbdestsearch,,"Fri, Nov 10 •  10:00 AM  + 2 more","New Jersey Convention and Exposition Center 97 Sunfield Avenue Edison, NJ 08837",Stone + Staley Art and Craft Shows,https://www.stoneandstaley.com,,,
New York,Queens,Corona,Literary Arts Festival,https://www.eventbrite.com/e/literary-arts-festival-tickets-735491152837?aff=ebdssbdestsearch,,"Sat, Oct 28 •  12:00 PM ","Queens Library Langston Hughes 100-01 Northern Boulevard Corona, NY 11368",Langston Hughes Library,,https://www.facebook.com/qllhughes,,
New York,Queens,Rosedale,LJMS Fall Festival,https://www.eventbrite.com/e/ljms-fall-festival-tickets-725574341387?aff=ebdssbdestsearch,,"Sat, Oct 21 •  11:00 AM ","The Gordon Parks School 233-15 Merrick Boulevard Queens, NY 11422",Laurissa Jane Music Studios LLC,https://ljanemusic.org,https://www.facebook.com/LJMusicStudio,https://www.twitter.com/LJaneMusic,
New York,Kings,Brooklyn,Canarsie Pop-Up Market,https://www.eventbrite.com/e/canarsie-pop-up-market-tickets-735603007397?aff=ebdssbdestsearch,,"Sat, Oct 21 •  3:00 PM ","Sylk Cove Cocktail Lounge, Rockaway Parkway, Brooklyn, NY, USA 1370 Rockaway Parkway Brooklyn, NY 11236",Rockaway Parkway Merchants Corridor Association Inc.,,,,
New Jersey,Middlesex,Fords,"Baria Diwali, Sat, Nov 18 @ Royal Albert Palace at 5:30 PM",https://www.eventbrite.com/e/baria-diwali-sat-nov-18-royal-albert-palace-at-530-pm-tickets-731573635437?aff=ebdssbdestsearch,,"Sat, Nov 18 •  5:30 PM ","Royal Albert's Palace, King Georges Post Road, Fords, NJ, USA 1050 King Georges Post Road Woodbridge Township, NJ 08863",,,,,
New York,Kings,Brooklyn,K Luxe Night Market,https://www.eventbrite.com/e/k-luxe-night-market-tickets-734853776427?aff=ebdssbdestsearch,,"Sat, Nov 11 •  5:00 PM ","K Luxe Atelier 1694 Flatbush Avenue Brooklyn, NY 11210",K Luxe Atelier,,,,
New York,Queens,Jamaica,Hands-on History: Black History & Literature Book Giveaway,https://www.eventbrite.com/e/hands-on-history-black-history-literature-book-giveaway-tickets-705562966827?aff=ebdssbdestsearch,,"Sat, Feb 17 •  1:00 PM ","King Manor Museum 150-03 Jamaica Avenue Queens, NY 11432",King Manor Museum,http://kingmanor.org,https://www.facebook.com/kingmanormuseum,https://www.twitter.com/kingmanormuseum,
New York,Queens,Glen Oaks,Pumpkin Picking,https://www.eventbrite.com/e/pumpkin-picking-tickets-733258063607?aff=ebdssbdestsearch,,Sunday • 2:00 PM,"Queens County Farm Museum, Little Neck Parkway, Queens, NY, USA 73-50 Little Neck Parkway Queens, NY 11004",WENERDNYC,,,,
New Jersey,Bergen,Woodcliff Lake,Tice's Corner Fall Harvest Festival 2023,https://www.eventbrite.com/e/tices-corner-fall-harvest-festival-2023-tickets-719947561537?aff=ebdssbdestsearch,,"Sat, Oct 21 •  10:00 AM ","Tice's Corner Marketplace 441 Chestnut Ridge Road Woodcliff Lake, NJ 07677",Tice's Corner Marketplace,,,,
New York,Kings,Brooklyn,Pearl of New York 2023,https://www.eventbrite.com/e/pearl-of-new-york-2023-tickets-594640655207?aff=ebdssbdestsearch,,"Thu, Oct 26 •  7:00 PM ","Roulette Intermedium 509 Atlantic Avenue Brooklyn, NY 11217",Pearl Art Group,,,,
New York,Queens,Jamaica,Your Queens 7th Annual Kwanzaa Celebration,https://www.eventbrite.com/e/your-queens-7th-annual-kwanzaa-celebration-tickets-733156529917?aff=ebdssbdestsearch,,"Sat, Dec 30 •  3:00 PM ","Roy Wilkins Recreation Center 177-01  Baisley Boulevard Queens, NY 11434",Your Queens Inc.,,,,
New York,New York,New York,#JobsOffice Virtual Job Fair / Career Expo Event #New York,https://www.eventbrite.com/e/jobsoffice-virtual-job-fair-career-expo-event-new-york-tickets-122404827133?aff=ebdssbdestsearch,,"Fri, Nov 3 •  11:00 AM  + 14 more","New York Virtual Event Only New York, NY 10007",JobsOffice.org,https://JobsOffice.org,,https://www.twitter.com/taohq,
New York,Queens,Cambria Heights,6th Annual Fall Festival,https://www.eventbrite.com/e/6th-annual-fall-festival-tickets-702619011377?aff=ebdssbdestsearch,,"Tue, Oct 31 •  3:00 PM ","Pear Tree Explorers Home Child Care, Inc. 11850 Cross Island Parkway Cambria Heights, NY 11411",Kima,,,,
Texas,Travis,Austin,#Auditors and #Advisors Virtual Job Fair / Career Expo Event #Austin #AUS,https://www.eventbrite.com/e/auditors-and-advisors-virtual-job-fair-career-expo-event-austin-aus-tickets-257634520787?aff=ebdssbdestsearch,,"Fri, Nov 3 •  11:00 AM  + 1 more","Austin Virtual event Austin, TX 78701",JobsOffice.org,https://JobsOffice.org,,https://www.twitter.com/taohq,
New York,Kings,Brooklyn,FAD Market at Brooklyn Brewery,https://www.eventbrite.com/e/fad-market-at-brooklyn-brewery-tickets-681067440047?aff=ebdssbdestsearch,,Saturday • 12:00 PM,"79 N 11th St 79 North 11th Street Brooklyn, NY 11249",FAD Market,http://www.fadmarket.co,https://www.facebook.com/fadmarket,https://www.twitter.com/fadmarket,
New Jersey,Bergen,Elmwood Park,Elmwood Park Community Day with Fireworks,https://www.eventbrite.com/e/elmwood-park-community-day-with-fireworks-tickets-718580823587?aff=ebdssbdestsearch,,"Sat, Oct 28 •  10:00 AM ","Borough Park 500 Mola Boulevard Elmwood Park, NJ 07407",JC Promotions,,https://www.facebook.com/JCPromotionsInc,https://www.twitter.com/jcupdate,
New York,Kings,Brooklyn,FAD Market: Fall Pop-up [Boerum Hill],https://www.eventbrite.com/e/fad-market-fall-pop-up-boerum-hill-tickets-681075143087?aff=ebdssbdestsearch,,"Sat, Oct 28 •  11:00 AM ","51 Bergen St 51 Bergen Street Brooklyn, NY 11201",FAD Market,http://www.fadmarket.co,https://www.facebook.com/fadmarket,https://www.twitter.com/fadmarket,
New York,New York,New York,New Amsterdam School Open House 10/14,https://www.eventbrite.com/e/new-amsterdam-school-open-house-1014-tickets-724055267797?aff=ebdssbdestsearch,,Saturday • 10:00 AM,"62 Avenue B 62 Avenue B New York, NY 10009",New Amsterdam School,,,,
New Jersey,Bergen,Montvale,St. Joseph Regional High School Craft Fair,https://www.eventbrite.com/e/st-joseph-regional-high-school-craft-fair-tickets-664239025807?aff=ebdssbdestsearch,,"Sun, Dec 10 •  11:00 AM ","40 Chestnut Ridge Rd 40 Chestnut Ridge Road Montvale, NJ 07645",Marshmallow Events,https://marshmallowevents.square.site/,https://www.facebook.com/100091437550131,,
New Jersey,Morris,Morris Plains,Jersey Makes Fall Arts & Craft Fair,https://www.eventbrite.com/e/jersey-makes-fall-arts-craft-fair-tickets-734483769727?aff=ebdssbdestsearch,,"Sat, Nov 11 •  11:00 AM ","Central Park of Morris County 1 Governor Chris Christie Drive Parsippany-Troy Hills, NJ 07950",Brilliant Conventions,,,,
New Jersey,Passaic,Ringwood,Pumpkin Chunkin! (Age 6-adult),https://www.eventbrite.com/e/pumpkin-chunkin-age-6-adult-tickets-690618567727?aff=ebdssbdestsearch,,"Sun, Oct 22 •  10:00 AM ","The New Weis Center for Education, Arts & Recreation 150 Snake Den Road Ringwood, NJ 07456","The New Weis Center for Education, Arts & Recreation",,https://www.facebook.com/newweiscenter,,
New York,Bronx,Bronx,Family Life Academy Charter Schools High School Open House Event,https://www.eventbrite.com/e/family-life-academy-charter-schools-high-school-open-house-event-tickets-736691673627?aff=ebdssbdestsearch,,"Fri, Apr 12 •  6:00 PM ","890 Washington Ave 890 Washington Avenue The Bronx, NY 10451",Family Life Academy Charter Schools,https://www.flacsnyc.com/,https://www.facebook.com/FLACSNYC,https://www.twitter.com/flacsnyc,
New York,Bronx,Bronx,Tropical Euphoria Jamaica,https://www.eventbrite.com/e/tropical-euphoria-jamaica-tickets-736620360327?aff=ebdssbdestsearch,,"Sat, Dec 30 •  10:00 AM ","Mile gully Manchester ja Ny Ny, NY 10466",@cognac_igloo_day_rave,,,,
New York,Westchester,Mamaroneck,Steinyfest '23,https://www.eventbrite.com/e/steinyfest-23-tickets-635372244487?aff=ebdssbdestsearch,,"Sat, Oct 21 •  4:00 PM ","New York Craft Coalition Brewery 139 Hoyt Avenue Mamaroneck, NY 10543",Steinyfest,https://www.steinyfest.com,,,
New York,Queens,Little Neck,Wrap & Ribbon Holiday Market 2023 - Vendors Wanted!,https://www.eventbrite.com/e/wrap-ribbon-holiday-market-2023-vendors-wanted-tickets-718564595047?aff=ebdssbdestsearch,,"Sun, Dec 10 •  12:00 PM ","Commonpoint Queens Sam Field Center 58-20 Little Neck Parkway Queens, NY 11362",Commonpoint Queens @ Sam Field Center,https://www.commonpointqueens.org,,,
New York,Nassau,Great Neck,Festival Of Song USA 29th Year,https://www.eventbrite.com/e/festival-of-song-usa-29th-year-tickets-695448704797?aff=ebdssbdestsearch,,"Sun, Jan 28 •  3:00 PM ","Leonard's Palazzo 555 Northern Boulevard Great Neck, NY 11021",Maria Grazia Romania (Lindh),,https://www.facebook.com/FestivalOfSongUSA,,
New York,Delaware,Trout Creek,Fright Fest,https://www.eventbrite.com/e/fright-fest-tickets-733575402777?aff=ebdssbdestsearch,,"Fri, Oct 27 •  10:00 PM ","Queens Queens NY Queens, NY 13847",AFROTRAPNYC,,,,
New York,Richmond,Staten Island,8th Annual New Dorp Restaurant Crawl,https://www.eventbrite.com/e/8th-annual-new-dorp-restaurant-crawl-tickets-699837872917?aff=ebdssbdestsearch,,"Sun, Oct 22 •  2:00 PM ","New Dorp Lane New Dorp Lane Staten Island, NY 10306",Anisa Bekteshi,,,,
New York,Queens,Astoria,Astoria Holiday Markket,https://www.eventbrite.com/e/astoria-holiday-markket-tickets-728830189717?aff=ebdssbdestsearch,,"Sun, Dec 10 •  12:00 PM ","Bohemian Hall & Beer Garden 29-19 24th Avenue Long Island City, NY 11102",Astoria Market,,https://www.facebook.com/astoriamarket,,
New Jersey,Middlesex,Highland Park,Night Owl Market 2023 - Vendor Registration,https://www.eventbrite.com/e/night-owl-market-2023-vendor-registration-tickets-694291864657?aff=ebdssbdestsearch,,"Sat, Oct 28 •  4:00 PM  + 5 more","Market Pavilion 212 Raritan Avenue Highland Park, NJ 08904",Main Street Highland Park,,https://www.facebook.com/MainStreetHP,https://www.twitter.com/MainStreetHP,
New Jersey,Bergen,Norwood,Norwood Community Day,https://www.eventbrite.com/e/norwood-community-day-tickets-735675093007?aff=ebdssbdestsearch,,"Sat, Oct 28 •  1:00 PM ","Kennedy Field 453 Broadway Norwood, NJ 07648",Norwood Boro,,,,
New York,Westchester,Mamaroneck,8th Annual Youth a Cappella Festival,https://www.eventbrite.com/e/8th-annual-youth-a-cappella-festival-tickets-703524028307?aff=ebdssbdestsearch,,"Sun, Oct 29 •  2:00 PM ","Mamaroneck High School, West Boston Post Road, Mamaroneck, NY, USA 1000 West Boston Post Road Mamaroneck, NY 10543",The Westchester Chordsmen,https://www.chordsmen.org,https://www.facebook.com/1618835228347632,https://www.twitter.com/chordsmen,
New York,Nassau,Albertson,TRUNK or TREAT,https://www.eventbrite.com/e/trunk-or-treat-tickets-728358007407?aff=ebdssbdestsearch,,"Sun, Oct 29 •  3:00 PM ","Beacon Church 201 I U Willets Road Albertson, NY 11507",Beacon Church,,,,
New Jersey,Middlesex,Metuchen,Metuchen Farmers Market - Saturdays 9 am -2 pm,https://www.eventbrite.com/e/metuchen-farmers-market-saturdays-9-am-2-pm-tickets-641076064767?aff=ebdssbdestsearch,,Saturday • 9:00 AM + 5 more,"33 Pearl St 33 Pearl Street Metuchen, NJ 08840",Metuchen Farmers Market,,,,
New York,New York,New York,Let's Get Homie Pop-Up Shop,https://www.eventbrite.com/e/lets-get-homie-pop-up-shop-tickets-727737671967?aff=ebdssbdestsearch,,Saturday • 11:00 AM,"434 East 9th Street, New York, NY, USA 434 East 9th Street New York, NY 10009",Let’s Get Homie,,,,
New York,Kings,Brooklyn,Gay Ass Wellness Festival (Again),https://www.eventbrite.com/e/gay-ass-wellness-festival-again-tickets-720591056247?aff=ebdssbdestsearch,,Sunday • 2:00 PM,"The Bush, Troutman Street, Brooklyn, NY, USA 333 Troutman Street #Store 4 Brooklyn, NY 11237",Fringe Pilates,https://www.fringepilates.com,,,
New Jersey,Middlesex,Metuchen,Haunted Downtown,https://www.eventbrite.com/e/haunted-downtown-tickets-734755572697?aff=ebdssbdestsearch,,"Sat, Oct 28 •  11:00 AM ","Metuchen Town Plaza 33 Pearl Street Metuchen, NJ 08840",Metuchen Downtown Alliance,,,,
New York,Nassau,East Rockaway,2023 Rolling River Fall Festival,https://www.eventbrite.com/e/2023-rolling-river-fall-festival-tickets-448381700737?aff=ebdssbdestsearch,,"Sat, Oct 21 •  12:00 PM ","Rolling River Day Camp 477 Ocean Avenue East Rockaway, NY 11518",Rolling River Events,https://www.rollingriverevents.com/,https://www.facebook.com/2139630189432611,,
New Jersey,Bergen,Hackensack,HACKENSACKtoberfest,https://www.eventbrite.com/e/hackensacktoberfest-tickets-706308637147?aff=ebdssbdestsearch,,Saturday • 1:00 PM,"Atlantic Street Park 102 State Street Hackensack, NJ 07601",Main Street Business Alliance,https://www.downtownhackensack.org,https://www.facebook.com/downtownhackensack,,
